{
  "$schema": "https://json-schema.org/draft/2020-12/schema",
  "$id": "https://responseboard.local/schema/status@1",
  "title": "ResponseBoard status",
  "description": "One LLM run's result in a shape the board can draw without reading prose. Written by the LLM (instruction file), a hook, or an extractor that reads the final response.",
  "type": "object",
  "required": ["schema", "project", "source", "run"],
  "additionalProperties": false,
  "properties": {
    "schema": { "const": "responseboard/status@1" },

    "project": {
      "type": "object",
      "required": ["name"],
      "additionalProperties": false,
      "properties": {
        "name": { "type": "string", "minLength": 1 },
        "path": { "type": "string", "description": "Folder the run worked in. Forward slashes." }
      }
    },

    "source": {
      "type": "object",
      "required": ["tool"],
      "additionalProperties": false,
      "description": "Which LLM tool produced the run. The board shows it but never branches on it.",
      "properties": {
        "tool": { "type": "string", "examples": ["claude-code", "codex-cli", "gemini-cli", "ollama"] },
        "model": { "type": "string" },
        "session_id": { "type": "string" },
        "written_by": {
          "enum": ["llm", "hook", "extractor", "manual"],
          "description": "llm = the model wrote this file itself; hook = a tool hook wrote it; extractor = built afterwards from the final response text; manual = a person or script wrote it with the rb command."
        }
      }
    },

    "run": {
      "type": "object",
      "required": ["status", "title"],
      "additionalProperties": false,
      "properties": {
        "id": { "type": "string", "description": "Leave it out: rb gives each run an id. The same id again replaces that run (a fix of the same run)." },
        "finished_at": { "type": "string", "format": "date-time", "description": "Leave it out: rb writes the time it records the run. An LLM does not know the time." },
        "status": { "$ref": "#/$defs/runStatus" },
        "title": { "type": "string", "maxLength": 40, "description": "What was done, one line." },
        "summary": { "type": "string", "maxLength": 120, "description": "At most two short sentences." },
        "asks": {
          "type": "array",
          "description": "Only decisions that need the user. Empty means nothing to answer.",
          "items": {
            "type": "object",
            "required": ["id", "question", "options"],
            "additionalProperties": false,
            "properties": {
              "id": { "type": "string" },
              "question": { "type": "string", "maxLength": 80 },
              "options": { "type": "array", "minItems": 2, "maxItems": 4, "items": { "type": "string", "maxLength": 40 } },
              "recommended": { "type": "integer", "minimum": 0, "description": "Index into options." }
            }
          }
        },
        "checks": {
          "type": "array",
          "items": {
            "type": "object",
            "required": ["name", "result"],
            "additionalProperties": false,
            "properties": {
              "name": { "type": "string" },
              "result": { "enum": ["pass", "fail", "skip"] },
              "detail": { "type": "string" }
            }
          }
        },
        "changes": {
          "type": "array",
          "items": {
            "type": "object",
            "required": ["path", "kind"],
            "additionalProperties": false,
            "properties": {
              "path": { "type": "string" },
              "kind": { "enum": ["added", "modified", "deleted"] }
            }
          }
        },
        "not_done": {
          "type": "array",
          "description": "What this run left for later, could not do, or decided not to do, with why. Shown as \"left\" next to what was done, grouped by where each item went.",
          "items": {
            "type": "object",
            "required": ["title"],
            "additionalProperties": false,
            "properties": {
              "title": { "type": "string", "maxLength": 60 },
              "reason": { "type": "string", "maxLength": 120 },
              "task": { "type": "string", "description": "Where the rest went: the id of a task in tasks that holds it." },
              "drop": { "type": "boolean", "description": "true when it was decided not to do it at all. With neither task nor drop the item is left behind." }
            }
          }
        },
        "notes": { "type": "string", "description": "The long explanation. Folded by default." },
        "from_next": { "type": "boolean", "description": "true when this run took up the previous run's next. A previous next that this run neither took up, kept as next, nor wrote in not_done is shown as left behind." },
        "next": {
          "type": "object",
          "required": ["title"],
          "additionalProperties": false,
          "description": "What to pick up next, written so that a reader coming back later can start without rereading the conversation.",
          "properties": {
            "title": { "type": "string", "maxLength": 40, "description": "The next piece of work, one line." },
            "detail": { "type": "string", "maxLength": 400, "description": "What it is, why it is next, and what decides when it is done." },
            "steps": { "type": "array", "maxItems": 8, "items": { "type": "string", "maxLength": 80 }, "description": "The first concrete steps, in order." },
            "task": { "type": "string", "description": "The id of the matching item in tasks, if there is one." }
          }
        }
      }
    },

    "section": {
      "type": "object",
      "required": ["title", "steps"],
      "additionalProperties": false,
      "description": "The stretch of work this run belongs to. A project has many sections over time; the history is grouped by them.",
      "properties": {
        "id": { "type": "string", "description": "Stable key of the section. Default: the title before \":\" (\"第 4 段: ...\" -> \"第 4 段\"). tasks[].section refers to it." },
        "title": { "type": "string" },
        "steps": {
          "type": "array",
          "minItems": 1,
          "items": {
            "type": "object",
            "required": ["title", "state"],
            "additionalProperties": false,
            "properties": {
              "title": { "type": "string", "maxLength": 24 },
              "state": { "$ref": "#/$defs/stepState" }
            }
          }
        }
      }
    },

    "tasks": {
      "type": "array",
      "description": "Whole-project kanban.",
      "items": {
        "type": "object",
        "required": ["id", "title", "column"],
        "additionalProperties": false,
        "properties": {
          "id": { "type": "string" },
          "title": { "type": "string", "maxLength": 40 },
          "column": { "enum": ["todo", "doing", "review", "done"] },
          "section": { "type": "string", "description": "The id of the section this task belongs to." },
          "asks": { "type": "integer", "minimum": 0, "description": "Open questions on this task." },
          "detail": { "type": "string", "maxLength": 400, "description": "What the task is and what decides when it is done. Carried over between runs with the rest of tasks." }
        }
      }
    },

    "history": {
      "type": "array",
      "description": "Earlier runs of this project, newest last. Filled from the history database by rb; do not write it by hand.",
      "items": {
        "type": "object",
        "required": ["finished_at", "status", "title"],
        "additionalProperties": false,
        "properties": {
          "finished_at": { "type": "string", "format": "date-time" },
          "status": { "$ref": "#/$defs/runStatus" },
          "title": { "type": "string" },
          "tool": { "type": "string" }
        }
      }
    },

    "git": {
      "type": "object",
      "description": "What this run changed in git (files and lines), for the status line. Filled by rb; do not write it by hand.",
      "additionalProperties": false,
      "properties": {
        "run": { "type": "string", "description": "run.id of the run these numbers belong to." },
        "files": { "type": "integer", "minimum": 0 },
        "add": { "type": "integer", "minimum": 0 },
        "del": { "type": "integer", "minimum": 0 }
      }
    },

    "left_behind": {
      "type": "array",
      "description": "not_done items of this project that have neither task nor drop yet, newest last. Filled by rb; do not write it by hand. Pick one up by writing it again in run.not_done with the same title and a task or drop.",
      "items": {
        "type": "object",
        "required": ["title"],
        "additionalProperties": false,
        "properties": {
          "title": { "type": "string" },
          "reason": { "type": "string" },
          "finished_at": { "type": "string", "format": "date-time" },
          "section_id": { "type": "string" }
        }
      }
    }
  },

  "$defs": {
    "runStatus": {
      "enum": ["done", "needs_you", "failed", "running"],
      "description": "done = nothing for the user to do; needs_you = asks is not empty; failed = stopped on an error; running = still working."
    },
    "stepState": { "enum": ["done", "doing", "todo", "blocked"] }
  }
}
